{
  "schema_version": "1.0",
  "media_type": "image",
  "generated_at": "2026-01-01T00:00:00+00:00",
  "input": {
    "file_name": "example_no_face.jpg",
    "sha256": "0000000000000000000000000000000000000000000000000000000000000000",
    "size_bytes": 19814,
    "width": 640,
    "height": 480
  },
  "model": {
    "name": "EfficientNet-B4",
    "version": "v2",
    "checkpoint": "best.pt",
    "checkpoint_sha256": "d00ae780e23a7f713d3f7af8e57e05a4a5e08382c005772499e9a7fcedabd107",
    "checkpoint_epoch": 3,
    "image_size": 380,
    "trained_on": "DeepFakeFace + a face-cropped subset of the OpenFake train split (74 generators)"
  },
  "score_semantics": "fake_probability is the detector's softmax probability for the MANIPULATED class (for videos: its mean over frames with a usable face). confidence is the probability of the predicted class. Neither is calibrated, neither is forensic certainty, and neither is the probability that the media is actually manipulated. Suggested wording: 'The detector assigned a fake-class probability of 0.91.'",
  "settings": {
    "config_file": "part2_forensics.yaml",
    "config_sha256": "1db01ef244bef367884829de603669d55147446f7c3f68a7f1e2032ad22fa628",
    "seed": 42,
    "attribution": {
      "method": "gradcam",
      "target_layer": "bn2",
      "target_class": 1,
      "target_score": "logit_diff",
      "consistency_atol": 0.0001
    },
    "localization": {
      "region_threshold": 0.5,
      "min_region_area": 0.0035,
      "max_regions": 3,
      "min_fake_probability": 0.5
    },
    "robustness": {
      "modes": [
        "pipeline",
        "fixed_crop"
      ],
      "min_overlap_fraction": 0.5,
      "perturbations": {
        "jpeg_quality": [
          90,
          70,
          50
        ],
        "downscale": [
          0.75,
          0.5
        ],
        "gaussian_blur_sigma": [
          1.0,
          2.0
        ],
        "brightness": [
          0.9,
          1.1
        ],
        "contrast": [
          0.9,
          1.1
        ],
        "gaussian_noise_sigma": [
          2.0
        ]
      }
    },
    "stability": {
      "mode": "pipeline",
      "margin_floor": 0.01,
      "weights": {
        "prediction": 0.4,
        "confidence": 0.3,
        "localization": 0.3
      },
      "bands": {
        "high": 0.8,
        "medium": 0.6
      },
      "cap_band": "MEDIUM",
      "sensitivity_weights": {
        "prediction_heavy": {
          "prediction": 0.5,
          "confidence": 0.3,
          "localization": 0.2
        },
        "equal": {
          "prediction": 0.34,
          "confidence": 0.33,
          "localization": 0.33
        },
        "localization_light": {
          "prediction": 0.45,
          "confidence": 0.45,
          "localization": 0.1
        }
      }
    },
    "evidence": {
      "robustness_modes": [
        "pipeline"
      ],
      "small_face_min_side": 122
    }
  },
  "artifacts": {
    "overlay": "example_no_face_overlay.png"
  },
  "status": "NO_FACE",
  "prediction": null,
  "confidence": null,
  "fake_probability": null,
  "real_probability": null,
  "face": {
    "found": false,
    "face_box": null,
    "face_score": null,
    "crop_box": null,
    "native_crop_side": null
  },
  "aggregation": null,
  "frames": null,
  "temporal_stability": null,
  "suspicious_intervals": [],
  "isolated_suspicious_frames": [],
  "observations": [],
  "localization": null,
  "suspicious_regions": [],
  "prediction_stability": null,
  "confidence_stability": null,
  "localization_stability": null,
  "evidence_stability": null,
  "robustness": null,
  "robustness_observations": [],
  "warnings": [
    {
      "code": "no_face_detected",
      "message": "No face was detected; the detector only analyses face crops, so no prediction was made."
    }
  ],
  "limitations": [
    "Trained on DeepFakeFace (Stable Diffusion fakes, InsightFace face swaps) and a face-cropped subset of OpenFake (74 diffusion and transformer image and video generators).",
    "On held-out OpenFake generators (sample of 1,300 images, only 90 real) ROC-AUC was 0.82, recall 68% and false-positive rate 17%; some generators (for example flux-2-klein-9b, 33% recall) are mostly missed.",
    "On StyleGAN-generated faces versus real FFHQ photos (5,045 images) ROC-AUC was 0.49, i.e. chance: GAN-generated faces are not detected.",
    "Confidence is the softmax probability of the predicted class (uncalibrated). It is not forensic certainty and not the probability that the image is actually manipulated.",
    "Only the largest detected face is analysed; images without a detectable face receive no prediction.",
    "Suspicious regions are model-indicated regions from Grad-CAM on a 12x12 feature grid (about 32 px per cell of the 380 px face crop); they are not ground-truth manipulated pixels. Localization accuracy is not yet measured (no manipulation masks are available).",
    "A small set of controlled perturbations; it does not cover all real-world distortion, and results on a few images do not generalise.",
    "The Evidence Stability Score is a project-defined summary of how the evidence held up under a small set of controlled perturbations. It is not a probability that the image is manipulated; the weights and bands are design choices, not calibrated.",
    "No face was detected, so the detector made no prediction and no forensic checks were run."
  ]
}
